{"entries":[],"expiresAt":"2026-10-31T10:11:57Z","generatedAt":"2026-10-31T09:46:55Z","listId":"revlist_gitea_pilot","schemaVersion":"1.0.0","sequence":40,"signature":{"algorithm":"sigstore-cosign","payloadDigest":"sha256:2cc0c15a58aeb112778a40ea2dcac4460854dfd84ecda69f1ed2b1e45a227777","signedAt":"2026-10-31T09:47:13Z","signedBy":"wazi-phase1-demo-pilot-20261030","value":"MEUCICazpe4mb7YijbqTkUs5BIGD6ksUBkrR2F0M5blxSMVPAiEAmgCXQKoZbs1FT44Bd+mVGfVlC+JItzF0UqbP5kRegHA="}}